{
  "contract_version": "ai-recipe-job.v1",
  "snapshot_id": "01365c74-28b5-4aa9-a9d1-f9c7f12b8792",
  "snapshot_revision": 3,
  "snapshot_sha256": "fede90d1e0e1c53df3b6108f474ef6857179d08ac360fa1328b7b8d2ff872805",
  "locale": "ko-KR",
  "steps": [
    {
      "step_id": "11111111-1111-4111-8111-111111111111",
      "order": 0,
      "recorded_at": "2026-07-31T01:00:00Z",
      "transcript": "삼겹살을 팬에 넣고 볶았어"
    },
    {
      "step_id": "22222222-2222-4222-8222-222222222222",
      "order": 1,
      "recorded_at": "2026-07-31T01:01:00Z",
      "transcript": "양파 반 개를 넣었어"
    }
  ]
}
